{
  "message_id": "01JB0000000000000000000011",
  "client_msg_id": "cli-1",
  "thread_id": "thread-1",
  "from_agent": "agent-1",
  "to_agents": ["agent-2"],
  "origin_node": "node-a",
  "destination_node": "node-b",
  "subject": "hello",
  "body": "hello there",
  "priority": "NORMAL",
  "delivery_mode": "WHEN_SAFE",
  "created_at": "2026-10-26T12:41:02.314+01:00",
  "expires_at": "2026-10-26T13:41:02.314+01:00",
  "requires_ack": true,
  "sensitivity": "INTERNAL",
  "thread_sequence": 1,
  "hop_count": 0,
  "route_digest": "sha256:0000000000000000000000000000000000000000000000000000000000000000",
  "control_version": 0
}
